key,title,item_type,url,doi
HUJMTUUW,Performance-oriented broadband inverse design of frequency-selective surfaces using multibranch autoencoders,journalArticle,https://ieeexplore.ieee.org/document/11274407/,10.1109/TMTT.2025.3633907
7C5VWXUM,A compact <i>E</i> -band load-modulation balanced power amplifier in 65-nm CMOS,journalArticle,https://ieeexplore.ieee.org/document/10546477/,10.1109/jssc.2024.3404610
J7ASQGD8,State Transfer Adaptive Matching Network Architecture (STA-MNA) Based on Deep Learning Used in RF Systems,conferencePaper,https://ieeexplore.ieee.org/document/11378688/,10.1109/APMC65046.2025.11378688
V9S3MBWP,Measurement-Driven Automated Design of High-Efficiency Power Amplifiers,conferencePaper,https://ieeexplore.ieee.org/document/10814353/,10.1109/ICICM63644.2024.10814353
WTWKBVN9,LASANA: Large-Scale Surrogate Modeling for Analog Neuromorphic Architecture Exploration,conferencePaper,https://ieeexplore.ieee.org/document/11189133/,10.1109/MLCAD65511.2025.11189133
JAWPPMIJ,ANN Based RF Energy Harvesting Antenna Design,conferencePaper,https://ieeexplore.ieee.org/document/10601049/,10.1109/SIU61531.2024.10601049
P9HIITPM,Neural Network based GaN HEMT Modelling for Millimeter Wave Power Amplifiers,conferencePaper,https://ieeexplore.ieee.org/document/9865646/,10.1109/IMS37962.2022.9865646
888WMN2X,Spiral Inductor ANN Scalable Model for 0.1um GaAs pHEMT Process,conferencePaper,https://ieeexplore.ieee.org/document/10812411/,10.1109/RFIT60557.2024.10812411
SHCT68JE,Novel Methods for Improved Particle Swarm Optimization in Designing the Bandgap Reference Circuit,journalArticle,https://ieeexplore.ieee.org/document/10353984/,10.1109/ACCESS.2023.3341492
JQREGAEF,Envelope Added Time-Delay Neural Network-based Digital Predistortion of Wideband Envelope Tracking Power Amplifiers,conferencePaper,https://ieeexplore.ieee.org/document/9618372/,10.1109/ICMMT52847.2021.9618372
HZTBRKTT,An Efficient Meta-Reinforcement Learning Approach for Circuit Linearity Calibration via Style Injection,conferencePaper,https://ieeexplore.ieee.org/document/10406135/,10.1109/MWSCAS57524.2023.10406135
7KU9BMKN,Self-Sensing Digital Predistortion of RF Power Amplifiers for 6G Intelligent Radio,journalArticle,https://ieeexplore.ieee.org/document/9677016/,10.1109/LMWC.2021.3139018
62MBJ4SF,Transfer Learning for the Behavior Prediction of Microwave Structures,journalArticle,https://ieeexplore.ieee.org/document/9930869/,10.1109/LMWC.2022.3214467
9QVE92WM,BLDC Engine Behavioral Model Approached with Machine Learning,conferencePaper,https://ieeexplore.ieee.org/document/11222176/,10.1109/CAS66707.2025.11222176
3GZEDHFX,A Design of Source-Switched Charge Pump Circuit with 65nm Technology by using Bayesian Optimization,conferencePaper,https://ieeexplore.ieee.org/document/10299853/,10.1109/ISEE59483.2023.10299853
KTZ2N4CV,Analog/Mixed-Signal Circuit Synthesis Enabled by the Advancements of Circuit Architectures and Machine Learning Algorithms,conferencePaper,https://ieeexplore.ieee.org/document/9712577/,10.1109/ASP-DAC52403.2022.9712577
CF5F5ARU,Machine Learning to Model and Predict Layout Dependent Effects on 55nm Low Power Platform,conferencePaper,https://ieeexplore.ieee.org/document/11017827/,10.1109/CSTIC64481.2025.11017827
TIRFVA4S,Transistor-Level A2 Trojan Anomaly Detection Method,conferencePaper,https://ieeexplore.ieee.org/document/11086025/,10.1109/EEISS65394.2025.11086025
5VIHCRPK,Spectral Probability Distribution of Crosstalk in Batches of Mixed Signal Circuits and an AI Design Tool,conferencePaper,https://ieeexplore.ieee.org/document/11197834/,10.1109/AE66163.2025.11197834
I39NIC79,Low-Power 9.6-11GHz and 10.8-12GHz VCOs Designed for a 2.5/5GHz TRx using High-Q Inductors Synthesized with ML Techniques,conferencePaper,https://ieeexplore.ieee.org/document/10745382/,10.1109/SMACD61181.2024.10745382
M5X433DI,Modeling of GaN HEMTs Based on BP Neural Networks,conferencePaper,https://ieeexplore.ieee.org/document/10813862/,10.1109/MAPE62875.2024.10813862
64MGFVC2,GaN Distributed RF Power Amplifer Automation Design with Deep Reinforcement Learning,conferencePaper,https://ieeexplore.ieee.org/document/9869961/,10.1109/AICAS54282.2022.9869961
7BHWK9I3,"Intelligent Analog and Mixed-Signal IC (I-AMS-IC) Design: A Conceptual Framework, and Case Study on AI Integration",conferencePaper,https://ieeexplore.ieee.org/document/11131067/,10.1109/IS3C65361.2025.11131067
7M7GBVUW,NeuroPump: Predictive Modeling of Charge Pump Performance Parameters Using Neural Network,conferencePaper,https://ieeexplore.ieee.org/document/11145006/,10.1109/TENSYMP63728.2025.11145006
2FPD6UV7,Automatic Optimal Design Method for Circuit Sizing Based on CNN Surrogate Model Assisted Differential Evolution Algorithm,journalArticle,https://ieeexplore.ieee.org/document/10683687/,10.1109/ACCESS.2024.3462952
SD5FW2KN,Generative AI for Analog Integrated Circuit Design: Methodologies and Applications,journalArticle,https://ieeexplore.ieee.org/document/10937153/,10.1109/ACCESS.2025.3553743
956N53R3,Millimeter-Wave Multi-Band Reconfigurable Differential Power Divider for 5G Communication,journalArticle,https://ieeexplore.ieee.org/document/9523605/,10.1109/TMTT.2021.3105120
UGIQE4UV,Automated Design of Analog Circuits Using Reinforcement Learning,journalArticle,https://ieeexplore.ieee.org/document/9576505/,10.1109/TCAD.2021.3120547
G35WEDFS,Multi-Gate Mixture-of-Experts for Predistortion of Power Amplifiers in Satellite Multi-Antenna System,journalArticle,https://ieeexplore.ieee.org/document/11114953/,10.1109/TVT.2025.3592389
UIC7TTS3,A Systematic Solution for the Problem of Spectral Degradation in Multiphase TX Architectures,journalArticle,https://ieeexplore.ieee.org/document/9476014/,10.1109/TCSII.2021.3095338
4YVAZH5Q,Conductive bridging-based memristive RF switches on a silicon substrate,journalArticle,https://ieeexplore.ieee.org/document/9609648/,10.1109/TMTT.2021.3124242
NA7PDKZH,Improved alternate test accuracy using weighted training sets,journalArticle,http://ieeexplore.ieee.org/document/7845263/,10.1109/DCIS.2016.7845263
TUTC2INP,2016_Liaperdos et al_Improved alternate test accuracy using w.pdf,attachment,https://ieeexplore.ieee.org/stampPDF/getPDF.jsp?tp=&arnumber=7845263&ref=,
UQAUREF6,Realization of a Power-Efficient Transmitter Based on Integrated Artificial Neural Network,journalArticle,https://ieeexplore.ieee.org/document/8529190/,10.1109/ACCESS.2018.2880033
ALCH89JY,2018_Kong et al_Realization of a Power-Efficient Transmi.pdf,attachment,https://ieeexplore.ieee.org/stampPDF/getPDF.jsp?tp=&arnumber=8529190&ref=,
QWI8XQGR,2016_Liaperdos et al_Improved alternate test accuracy using w.pdf,attachment,https://ieeexplore.ieee.org/stampPDF/getPDF.jsp?tp=&arnumber=7845263&ref=,
I49F4IZJ,A 12-lead ECG integrated circuit design with adjustable gain and bandwidth schemes,conferencePaper,https://ieeexplore.ieee.org/document/8311814/,10.1109/iFUZZY.2017.8311814
284PREGT,2017_Wu et al_A 12-lead ECG integrated circuit design.pdf,attachment,https://ieeexplore.ieee.org/stampPDF/getPDF.jsp?tp=&arnumber=8311814&ref=,
H9VXTFRI,2017_Wu et al_A 12-lead ECG integrated circuit design.pdf,attachment,https://ieeexplore.ieee.org/stampPDF/getPDF.jsp?tp=&arnumber=8311814&ref=,
B4XHABUV,2018_Kong et al_Realization of a Power-Efficient Transmi.pdf,attachment,https://ieeexplore.ieee.org/stampPDF/getPDF.jsp?tp=&arnumber=8529190&ref=,
AHT2ANDK,Analog Fault Identification in RF Circuits using Artificial Neural Networks and Constrained Parameter Extraction,conferencePaper,https://ieeexplore.ieee.org/document/8503117/,10.1109/NEMO.2018.8503117
3EAE3C39,2018_Viveros-Wacher et al_Analog Fault Identification in RF Circui.pdf,attachment,https://ieeexplore.ieee.org/stampPDF/getPDF.jsp?tp=&arnumber=8503117&ref=,
XPFI8A5E,An Accuracy Improvement of the Neuromorphic Functional Models by Using the Parallel ANN Architecture,conferencePaper,https://ieeexplore.ieee.org/document/9225034/,10.1109/EWDTS50664.2020.9225034
QBQSAFTA,2020_Mosin et al_An Accuracy Improvement of the Neuromorp.pdf,attachment,https://ieeexplore.ieee.org/stampPDF/getPDF.jsp?tp=&arnumber=9225034&ref=,
GKB2HUGI,Nonlinear models of digital filters and their application fields,journalArticle,http://ieeexplore.ieee.org/document/7779351/,10.1109/RED.2016.7779351
5PYEWRXN,2016_Solovyeva et al_Nonlinear models of digital filters and.pdf,attachment,https://ieeexplore.ieee.org/stampPDF/getPDF.jsp?tp=&arnumber=7779351&ref=,
IVCHUUP9,A four-way series doherty digital polar transmitter at mm-wave frequencies,journalArticle,https://ieeexplore.ieee.org/document/9675289/,10.1109/JSSC.2021.3133861
BC45G5YP,SAW-Less Direct RF Transmitter With Multimode Noise Shaping and Tri-Level Time-Approximation Filter,journalArticle,https://ieeexplore.ieee.org/document/9568646/,10.1109/JSSC.2021.3116933
R83ZNN95,Bandwidth optimization of doherty power amplifier based on source converters for 5G mobile handsets,journalArticle,https://ieeexplore.ieee.org/document/9618639/,10.1109/TMTT.2021.3124302
PUMWISJR,Deep Learning Driven Design of Highly Efficient Harmonic-Tuned Class F<sup>-1</sup> Power Amplifiers,journalArticle,https://ieeexplore.ieee.org/document/11235187/,10.23919/EuMC65286.2025.11235187
5H9VQK76,Deep Reinforcement Learning for Analog Circuit Structure Synthesis,journalArticle,https://ieeexplore.ieee.org/document/9774699/,10.23919/DATE54114.2022.9774699
F3M4AIRD,Efficient Performance Modeling for Automated CMOS Analog Circuit Synthesis,journalArticle,https://ieeexplore.ieee.org/document/9528897/,10.1109/TVLSI.2021.3107404
JQV7KWIG,"Machine Learning Technologies for RF/Microwave CAD: Past, Present and Future Perspectives",journalArticle,https://ieeexplore.ieee.org/document/9991872/,10.23919/EuMC54642.2022.9991872
ZBPE55IF,Time-Domain 3D Electromagnetic Fields Estimation Based on Physics-Informed Deep Learning Framework,journalArticle,https://ieeexplore.ieee.org/document/10992916/,10.23919/DATE64628.2025.10992916
G2E7CFVD,AI-Driven Electromagnetic Prediction with Pixelated Matching Networks for Broadband and Miniaturized Rectifier Design,journalArticle,https://ieeexplore.ieee.org/document/11394400/,10.23919/PIERS-Fall62445.2025.11394400
3QVMAT6P,Fast Synthesized Methods of Radio Frequency Filter Based on Neural Network,journalArticle,https://ieeexplore.ieee.org/document/10249781/,10.23919/ACES-China60289.2023.10249781
SX6TRTZI,Study of Spiking Neural Network-Based Regressor on Applications in Digital Predistortion for Power Amplifiers,journalArticle,https://ieeexplore.ieee.org/document/10365305/,10.1109/CommNet60167.2023.10365305
NM4UU4PF,Digital Predistortion of RF Power Amplifiers using DeepShift,journalArticle,https://ieeexplore.ieee.org/document/10119079/,10.1109/WCNC55385.2023.10119079
MW6EPM53,Research on Conducted Immunity Quantification Model of Operational Amplifier Based on Neural Networks and Feature Extraction,journalArticle,https://ieeexplore.ieee.org/document/10249590/,10.23919/ACES-China60289.2023.10249590
ABUT8TGG,6GS/s 8-channel CIC SAR TI-ADC with Neural Network Calibration,journalArticle,https://ieeexplore.ieee.org/document/9911287/,10.1109/ESSCIRC55480.2022.9911287
8Q8FW6UN,Data-Driven Leakage Power Prediction and Optimization for Analog Circuits Via Machine Learning and Deep Neural Networks,journalArticle,https://ieeexplore.ieee.org/document/11409499/,10.1109/EIECC67963.2025.11409499
D3CKDVAD,A Two-step Fine-tuning Assisted Layout Sizing Scheme for Analog/RF Circuits,journalArticle,https://ieeexplore.ieee.org/document/10558541/,10.1109/ISCAS58744.2024.10558541
C53C8Z25,Building Post-layout Performance Model of Analog/RF Circuits by Fine-tuning Technique,journalArticle,https://ieeexplore.ieee.org/document/9806251/,10.1109/ISQED54688.2022.9806251
F7PRC8DW,An Efficient Transfer Learning Assisted Global Optimization Scheme for Analog/RF Circuits,journalArticle,https://ieeexplore.ieee.org/document/10473798/,10.1109/ASP-DAC58780.2024.10473798
8KRK8TSN,Deep-Neural-Network-Based Automated Transformer Design for Multistage Wideband Millimeter-Wave Power Amplifiers,journalArticle,https://ieeexplore.ieee.org/document/11433107/,10.1109/TMTT.2026.3663369
67NQ2VB8,Neural Network-Based Wiener-Hammerstein Model for the Cancellation of Self-Interference in FDD Systems,journalArticle,https://ieeexplore.ieee.org/document/10603173/,10.1109/ICCCS61882.2024.10603173
ZEUTJPBU,Topology Generic DC-Model for Accelerating Analog Circuit Optimization,journalArticle,https://ieeexplore.ieee.org/document/10218550/,10.1109/ISEDA59274.2023.10218550
I6DVW7W7,DC-Model: A New Method for Assisting the Analog Circuit Optimization,journalArticle,https://ieeexplore.ieee.org/document/10129366/,10.1109/ISQED57927.2023.10129366
4ZSNQTPQ,Residual Real-Valued Time-Delay Convolutional Neural Network for Behavioral Modeling and Digital Predistortion,journalArticle,https://ieeexplore.ieee.org/document/10671957/,10.1109/ICMMT61774.2024.10671957
UAEU2CRW,Lightweight Complex-Valued Delay RBFNN for Predistortion of Wideband Power Amplifiers,journalArticle,https://ieeexplore.ieee.org/document/11151110/,10.1109/ICWOC65853.2025.11151110
PVQ5UUB5,Deep Learning-Assisted Inverse Design of Pixelated Two-Port RF Matching Networks,journalArticle,https://ieeexplore.ieee.org/document/11168098/,10.1109/iWEM65640.2025.11168098
UFT5NKAP,Dual-band Transmitter Linearization using Spiking Neural Networks,journalArticle,https://ieeexplore.ieee.org/document/9999916/,10.23919/APMC55665.2022.9999916
ZU4XX3VN,Behavioral Modeling of Nonlinear Power Amplifiers Using Spiking Neural Networks,journalArticle,https://ieeexplore.ieee.org/document/9842167/,10.1109/NEWCAS52662.2022.9842167
F4DQQVIZ,A Novel Transfer Learning Approach for Efficient RF Device Behavior Model Parameter Extraction,journalArticle,https://ieeexplore.ieee.org/document/10600238/,10.1109/IMS40175.2024.10600238
FT4C39D8,Behavioral Modeling of Ultra-Broadband mmWave Power Amplifier based on Augmented Long-Short Term Memory Networks,journalArticle,https://ieeexplore.ieee.org/document/9790468/,10.1109/iWEM53379.2021.9790468
PA67WEEV,Multidimensional Load-Pull Extrapolation for Accelerated Computer-Aided Design (CAD) Simulations,journalArticle,https://ieeexplore.ieee.org/document/10907182/,10.23919/USNC-URSINRSM66067.2025.10907182
9D7TP7BM,Multi-Dimensional Image Completion for Automated Power Amplifier Design,journalArticle,https://ieeexplore.ieee.org/document/10465124/,10.23919/USNC-URSINRSM60317.2024.10465124
76PTCB5F,Notice of Removal: An Ultra-wideband ADC using LSTM and Photonic Time Stretching,journalArticle,https://ieeexplore.ieee.org/document/10736266/,10.1109/MWP62612.2024.10736266
P7PR63S2,"Applications of Deep Learning Algorithms for RFEH, WPT and SWIPT Systems: A Review",journalArticle,https://ieeexplore.ieee.org/document/10265420/,10.23919/URSIGASS57860.2023.10265420
IIBQRH2Z,Multiphysics Analysis for Design-Assembly Consolidation with Additively Manufactured Waveguide Structures,journalArticle,https://ieeexplore.ieee.org/document/11052601/,10.23919/ACES66556.2025.11052601
9C94ZKGN,A Multiphysics-Based Machine Learning Framework for the Electromagnetic and Thermal Analysis of Electronic Devices,journalArticle,https://ieeexplore.ieee.org/document/11052495/,10.23919/ACES66556.2025.11052495
36GR4Z4G,A Data-Driven Analog Circuit Synthesizer with Automatic Topology Selection and Sizing,journalArticle,https://ieeexplore.ieee.org/document/10546840/,10.23919/DATE58400.2024.10546840
5BWJTPGK,New Concept of Analogue Adaptive Filter Based on Fully Analogue Artificial Neural Network,journalArticle,https://ieeexplore.ieee.org/document/9920436/,10.23919/NTSP54843.2022.9920436
XFMXHWWQ,Physics-Informed Graph Neural Networks for the Inverse Design of GHz Reconfigurable Antenna,journalArticle,https://ieeexplore.ieee.org/document/10999666/,10.23919/EuCAP63536.2025.10999666
A79TFA7J,Solving Inverse Problems with Deep Learning,journalArticle,https://ieeexplore.ieee.org/document/11052472/,10.23919/ACES66556.2025.11052472
KFFAK93P,CRONuS: Circuit Rapid Optimization with Neural Simulator,journalArticle,https://ieeexplore.ieee.org/document/10546592/,10.23919/DATE58400.2024.10546592
6W9XPQ65,An Algorithm for Converting PCB Via Structure to a Voxelized Mesh for Artificial Intelligence Models,journalArticle,https://ieeexplore.ieee.org/document/10906911/,10.23919/USNC-URSINRSM66067.2025.10906911
S9DWP97H,RF MEMS Switch Design Methodology by Electromagnetic Simulations and Machine Learning,journalArticle,https://ieeexplore.ieee.org/document/9924321/,10.23919/EuMC54642.2022.9924321
2Q3HNRMX,Sustainable Learning Multi-State Modeling of RF Power Amplifiers in Terahertz Communication Systems: Residual Deep Networks and Dynamic Calibration Optimization,journalArticle,https://ieeexplore.ieee.org/document/11394014/,10.23919/PIERS-Fall62445.2025.11394014
NFIS759J,Data-Driven Full-Functionality Modeling of Broadband Radio Frequency Components,journalArticle,https://ieeexplore.ieee.org/document/11235160/,10.23919/EuMC65286.2025.11235160
DV75XEJ3,Functionality Pre-Encoding: Indirect Learning Technique for Radio Frequency Devices Characterization,journalArticle,https://ieeexplore.ieee.org/document/11235217/,10.23919/EuMC65286.2025.11235217
P5XWV4EW,From Specification to Silicon: Towards Analog/Mixed-Signal Design Automation using Surrogate NN Models with Transfer Learning,journalArticle,https://ieeexplore.ieee.org/document/9643445/,10.1109/ICCAD51958.2021.9643445
5X7PMJSB,VSAGE: An End-to-End Automated VCO-Based ΔΣ ADC Generator,journalArticle,https://ieeexplore.ieee.org/document/10777924/,10.1109/TVLSI.2024.3507567
ZPKG4IBW,A 512-nW 0.003-mm² Forward-Forward Closed Box Trainer for an Analog Voice Activity Detector in 28-nm CMOS,journalArticle,https://ieeexplore.ieee.org/document/10660552/,10.1109/TCSII.2024.3452112
67S7Z8V8,Multi-Task Evolutionary to PVT Knowledge Transfer for Analog Integrated Circuit Optimization,journalArticle,https://ieeexplore.ieee.org/document/10323899/,10.1109/ICCAD57390.2023.10323899
5DC6R8E2,A Background Timing Skew Calibration for Time-Interleaved ADCs Based on Frequency Fitness Genetic Algorithm,journalArticle,https://ieeexplore.ieee.org/document/10373186/,10.1109/TIM.2023.3346515
7XJMED3J,Circuit Optimization over Multiple Process Corners for Analog Electronic Design Automation,journalArticle,https://ieeexplore.ieee.org/document/10275299/,10.1109/ICAC57885.2023.10275299
94CTA6AB,Decoupling Analog Circuit Representation from Technology for Behavior-Centric Optimization,journalArticle,https://ieeexplore.ieee.org/document/11133189/,10.1109/DAC63849.2025.11133189
EMS4JASR,Machine Learning-based Fast Circuit Simulation for Analog Circuit Array,journalArticle,https://ieeexplore.ieee.org/document/10299876/,10.1109/MLCAD58807.2023.10299876
NR48NUNJ,Fast IR-Drop Prediction of Analog Circuits Using Recurrent Synchronized GCN and Y-Net Model,journalArticle,https://ieeexplore.ieee.org/document/10546845/,10.23919/DATE58400.2024.10546845
MFE647XZ,Encoding Network Optimization with Phase Quantization for the Machine-Learning-based Coding Digital Receiving Array,journalArticle,https://ieeexplore.ieee.org/document/10222580/,10.1109/IWS58240.2023.10222580
VNHW9U3N,Parasitic Capacitance Prediction for Standard Cells Using Machine Learning and K-Means Clustering Algorithm,journalArticle,https://ieeexplore.ieee.org/document/10879646/,10.1109/ICEIC64972.2025.10879646
M2PT9VN6,AI-Assisted EM Simulator For The Randomized Pixelated RF Components,journalArticle,https://ieeexplore.ieee.org/document/11378046/,10.1109/APMC65046.2025.11378046
4FG82GF8,Machine-Learning-Based Design Automation for Optimizing Analog/RF Circuit Applications,journalArticle,https://ieeexplore.ieee.org/document/10390878/,10.1109/IC-NIDC59918.2023.10390878
M2H9GFT5,Active Learning-Based Sampling for Surrogate Modeling of Microstrip Bandpass Filters,journalArticle,https://ieeexplore.ieee.org/document/11419031/,10.1109/IMFW64610.2026.11419031
838QIGT7,Deep Neural Network RF Model for SiGe HBT in Breakdown Regime,journalArticle,https://ieeexplore.ieee.org/document/10286855/,10.1109/LMWT.2023.3321629
R2GETN9X,A Neural-Recording 0.2-V VCO-based ADC with Machine-Learning-Programmable Coupled Oscillator Ensembles,journalArticle,https://ieeexplore.ieee.org/document/10162043/,10.1109/ISSC59246.2023.10162043
SIC799AX,Heterogeneous Integration of Optical Biosensing with Electrode Coated ECG and PPG Applications,journalArticle,https://ieeexplore.ieee.org/document/11082210/,10.1109/WOCC63563.2025.11082210
JRI7GTKC,Analysis of Graphene-Silicon Based Two-Port THz Patch Antenna using Machine Learning Algorithms,journalArticle,https://ieeexplore.ieee.org/document/10967897/,10.1109/CSNT64827.2025.10967897
Z72NE6ES,Machine Learning-Aided Piece-Wise Modeling Technique of Power Amplifier for Digital Predistortion,journalArticle,https://ieeexplore.ieee.org/document/10096989/,10.1109/ICASSP49357.2023.10096989
5M4GH26D,Using Neural Networks for Semiconductor Package Optimization,journalArticle,https://ieeexplore.ieee.org/document/10161948/,10.1109/ORSS58323.2023.10161948
BHE266A4,Performance Prediction of Power Amplifiers for the Extended Bandwidth via Neural Networks,journalArticle,https://ieeexplore.ieee.org/document/10224038/,10.1109/SIU59756.2023.10224038
V2HS7MRP,Combinational of GAN and LSTM-Based DNN for Automatic Optimization of Active and Passive Devices,journalArticle,https://ieeexplore.ieee.org/document/11266320/,10.1109/AP-S/CNC-USNC-URSI55537.2025.11266320
P7KTX58C,Combination of Pareto Optimal Front with Deep Neural Networks in Optimizing and Enhancing Performance of RF Designs,journalArticle,https://ieeexplore.ieee.org/document/10223987/,10.1109/SIU59756.2023.10223987
IHBTCH7G,Power Amplifier Modeling along with Hyperparameter Optimization of LSTM-based DNN through Multi-Verse Optimizer,journalArticle,https://ieeexplore.ieee.org/document/11091948/,10.1109/SMACD65553.2025.11091948
79PQFGEF,Fully Automated Inside Body WDT Transmitter Design and Optimization Through Artificial Intelligence-Based GANs and DNNs,journalArticle,https://ieeexplore.ieee.org/document/10817101/,10.1109/LAWP.2024.3523379
A8WUFKZV,Late Breaking Results: Automated Topology Generation for Power Amplifier Designs through BiLSTM-based DNN and Multi-objective Optimizations,journalArticle,https://ieeexplore.ieee.org/document/11133206/,10.1109/DAC63849.2025.11133206
NIWUA575,Machine Learning-Based Parametric Fault Detection in Analog and Mixed-Signal Circuits,journalArticle,https://ieeexplore.ieee.org/document/11116895/,10.1109/IOLTS65288.2025.11116895
R25EDRQA,Accuracy Is Not Always We Need: Precision-Aware Bayesian Yield Optimization,journalArticle,https://ieeexplore.ieee.org/document/11133024/,10.1109/DAC63849.2025.11133024
8SXEBX85,Machine Learning Algorithms Based on Variations of the Least Squares Method for Power Amplifier Distortion Compensation,journalArticle,https://ieeexplore.ieee.org/document/10947698/,10.1109/IEEECONF64229.2025.10947698
DKZWZ3J4,OATT: Outlier Oriented Alternative Testing and Post-Manufacture Tuning of Mixed-Signal/RF Circuits and Systems,journalArticle,https://ieeexplore.ieee.org/document/10350043/,10.1109/ITC51656.2023.00014
EN5SZWVE,AI-Powered Revolution,journalArticle,https://ieeexplore.ieee.org/document/10908607/,10.1109/MNANO.2025.3533936
M25G4FD9,A Side-Channel Attack-Resilient Single-Slope ADC for Image Sensor Applications,journalArticle,https://ieeexplore.ieee.org/document/11092095/,10.1109/SMACD65553.2025.11092095
PJ7R3V3I,Optimized Low-Power Mixed-Signal Sensor Systems: Improved Cross-Domain Approach to Maintain Classification Accuracy,journalArticle,https://ieeexplore.ieee.org/document/10967955/,10.1109/ICICACS65178.2025.10967955
ZGP6C9HR,On Digital Optimization of Analog Self-Interference Cancellation for Full-Duplex Wireless Systems,journalArticle,https://ieeexplore.ieee.org/document/11226115/,10.23919/EUSIPCO63237.2025.11226115
92BBMHU3,LEDRO: LLM-Enhanced Design Space Reduction and Optimization for Analog Circuits,journalArticle,https://ieeexplore.ieee.org/document/11106097/,10.1109/ICLAD65226.2025.00011
M78I5QU5,Artificial Neural Network-Based Compact Model for Circuit Simulation of a 4- Transistor Active Pixel Sensor Including Conversion Gain Prediction,journalArticle,https://ieeexplore.ieee.org/document/10457179/,10.1109/ICEIC61013.2024.10457179
DVWV7T9W,Deep learning-driven phase calibration methodology for enhanced beamforming in integrated optical phased array,journalArticle,https://ieeexplore.ieee.org/document/10544128/,10.1109/SiPhotonics60897.2024.10544128
2I29A2W7,PPAAS: PVT and Pareto Aware Analog Sizing via Goal-conditioned Reinforcement Learning,journalArticle,https://ieeexplore.ieee.org/document/11240795/,10.1109/ICCAD66269.2025.11240795
6DCA45A2,Novel Optimization Method of Multi-Devices Using TCAD Driven Machine Learning in BCD Process,journalArticle,https://ieeexplore.ieee.org/document/11118175/,10.23919/ISPSD62843.2025.11118175
QTSNBMPJ,Ultra-Fast and Efficient Design Method Using Deep Learning for Capacitive Coupling WPT System,journalArticle,https://ieeexplore.ieee.org/document/10264117/,10.1109/TPEL.2023.3319505
7KTE6NVU,"Development, Optimization, and Application of ML based Modeling of Printed VO<sub>2</sub> RF Switch",journalArticle,https://ieeexplore.ieee.org/document/10378928/,10.1109/ICM60448.2023.10378928
W22HV9E2,Gradient Descent ANN Modelling of RF MEMS Switch for Defense Applications,journalArticle,https://ieeexplore.ieee.org/document/10046718/,10.1109/MAPCON56011.2022.10046718
TKAJRR4H,RF filter design using Deep Learning and Artificial Intelligence,journalArticle,https://ieeexplore.ieee.org/document/10038522/,10.1109/NEMO51452.2022.10038522
QNT2CIVU,RI-SAR: Randomized Input SAR ADC Resilient to Power Side Channel Attacks,journalArticle,https://ieeexplore.ieee.org/document/10317991/,10.1109/PAINE58317.2023.10317991
