key,title,item_type,url,doi
WP4AST2V,Digital Signal Recovery With Transmitter Nonlinear State Tracking for Satellite Communications,journalArticle,https://ieeexplore.ieee.org/document/9792424/,10.1109/TCSII.2022.3181785
97JUVKD6,Kernel-Enhanced Deep Learning for Temperature-Dependent Electromagnetic Susceptibility Modeling of Analog Sensors,journalArticle,https://ieeexplore.ieee.org/document/11409433/,10.1109/TEMC.2026.3662209
SG4DJUX5,A Linear-Regression-Assisted Trimming Scheme for CMOS Voltage Reference,journalArticle,https://ieeexplore.ieee.org/document/11044284/,10.1109/ISCAS56072.2025.11044284
5DEGKMTE,Enhancing Analog IC Security Using Randomized Obfuscation Circuits,journalArticle,https://ieeexplore.ieee.org/document/10689372/,10.1109/TCAD.2024.3466810
DDETTPE3,Integrating Neural Network Models for Advanced Automation in Analog Amplifier Circuit Design,journalArticle,https://ieeexplore.ieee.org/document/10677072/,10.1109/CONECCT62155.2024.10677072
7FC27HT3,A Novel TriNet Architecture for Enhanced Analog IC Design Automation,journalArticle,https://ieeexplore.ieee.org/document/10672521/,10.1109/TVLSI.2024.3452032
6KTBGH4N,Digital Pre-Distortion Modeling and Optimization Method Based on Sparse Residual GRU Neural Network,journalArticle,https://ieeexplore.ieee.org/document/11337151/,10.1109/Ucom67224.2025.11337151
HXF9Q2PD,A Low-cost Method for Identifying Pre-distortion Coefficients of RF Power Amplifiers Based on AE-GILC,journalArticle,https://ieeexplore.ieee.org/document/10618745/,10.1109/PIERS62282.2024.10618745
3ANSBGUB,Cyber Wolf: A Hybrid Optimization Framework Leveraging Heterogeneous Graphs and Multimodal Surrogate Simulators for Fast Analog Sizing,journalArticle,https://ieeexplore.ieee.org/document/11307005/,10.1109/AEET66561.2025.11307005
STMJSEE6,A Residual Selectable Modeling Method Based on Deep Neural Network for Power Amplifiers With Multiple States,journalArticle,https://ieeexplore.ieee.org/document/10587151/,10.1109/LMWT.2024.3420398
KDG28UW6,Modeling And Linearization of Radio Frequency Power Amplifiers Using Machine Learning Approaches,journalArticle,https://ieeexplore.ieee.org/document/10423509/,10.1109/IEMENTech60402.2023.10423509
CP4G2MWE,An Intelligent healthcare system for clinical decision making using Fuzzy neural networks,journalArticle,https://ieeexplore.ieee.org/document/11059089/,10.1109/ICACCM61117.2024.11059089
CTRN4ICK,Development of AI-Based Simulation Circuit Design and Assistance Systems,journalArticle,https://ieeexplore.ieee.org/document/10828016/,10.1109/ICCASIT62299.2024.10828016
AMDFSTWB,Optimization of the Far-Field Pattern of an X-Band Electronically Controlled Reflectarray Antenna Assisted by Machine Learning,journalArticle,https://ieeexplore.ieee.org/document/10925225/,10.1109/EMTS57498.2023.10925225
BVN9G96T,Deep Learning-Based Performance Testing for Analog Integrated Circuits,journalArticle,https://ieeexplore.ieee.org/document/10759335/,10.1109/TVLSI.2024.3496777
HBJC7XFN,Accelerated Design and Characterization of Inductive Position Sensors through AI-Driven Design Support System,journalArticle,https://ieeexplore.ieee.org/document/11197010/,10.1109/TMAG.2025.3619032
CX6AMND6,Stochastic Optimization of the CPL-Function-Based Model for RF Power Transistors,journalArticle,https://ieeexplore.ieee.org/document/9741844/,10.1109/LMWC.2022.3149751
TFG2QBCT,An Overview of the Optimization of RF Power Amplifiers using a Bayesian Algorithm : (Invited),journalArticle,https://ieeexplore.ieee.org/document/10192208/,10.1109/SMACD58065.2023.10192208
JRJZZC5X,A High-Efficiency and Dual-Mode Huygens Rectenna Enabled Wireless Charging System for Supercapacitors Realized by Voltage-Dependent S-Parameter Analysis and Deep Learning,journalArticle,https://ieeexplore.ieee.org/document/11329070/,10.1109/JWPT.2025.3650741
UAJXB93D,Reinforcement Learning for Electronic Design Automation: Case Studies and Perspectives: (Invited Paper),journalArticle,https://ieeexplore.ieee.org/document/9712578/,10.1109/ASP-DAC52403.2022.9712578
TRP2C32X,Industry Paper: Surrogate Models for Testing Analog Designs under Limited Budget – a Bandgap Case Study,journalArticle,https://ieeexplore.ieee.org/document/9943132/,10.1109/CODES-ISSS55005.2022.00016
ZS2MHCGR,Machine Learning Based Static and Dynamic Error Calibration in Data Converters,journalArticle,https://ieeexplore.ieee.org/document/10538754/,10.1109/VTS60656.2024.10538754
AEHFFDHS,Machine-learning based Blind Digital Calibration of Time-Interleaved ADC,journalArticle,https://ieeexplore.ieee.org/document/11022918/,10.1109/VTS65138.2025.11022918
3AW4KTBD,Hybrid AI-Optimization Method for Latent Defect Detection Through Test Transistor Insertion in Analog Circuits,journalArticle,https://ieeexplore.ieee.org/document/11092178/,10.1109/SMACD65553.2025.11092178
QVUA2HXN,Enhancing Performance of SAR ADC through Supervised Machine Learning,journalArticle,https://ieeexplore.ieee.org/document/10558198/,10.1109/ISCAS58744.2024.10558198
CMSSUZTS,AI/ML: A powerful tool for future microwave engineering problems,journalArticle,https://ieeexplore.ieee.org/document/10463890/,10.1109/MAPCON58678.2023.10463890
42A3QHTG,Intelligent Modeling of Circular Microstrip Antenna for RF Energy Harvesting Applications,journalArticle,https://ieeexplore.ieee.org/document/10528072/,10.1109/WAMS59642.2024.10528072
I9FF6PDI,Genetic Algorithm for Microwave Computer-Aided Design: The State of the Art,journalArticle,https://ieeexplore.ieee.org/document/10293468/,10.1109/AFRICON55910.2023.10293468
KEA3UMEG,Circuits-Informed Machine Learning Technique for Blind Open-Loop Digital Calibration of SAR ADC,journalArticle,https://ieeexplore.ieee.org/document/11082833/,10.1109/RFIC61188.2025.11082833
KU65ERXA,Effective Analog ICs Floorplanning with Relational Graph Neural Networks and Reinforcement Learning,journalArticle,https://ieeexplore.ieee.org/document/10992888/,10.23919/DATE64628.2025.10992888
ZGPZZI8R,Fast ML-driven Analog Circuit Layout using Reinforcement Learning and Steiner Trees,journalArticle,https://ieeexplore.ieee.org/document/10745442/,10.1109/SMACD61181.2024.10745442
KN4WMNJM,Application of Deep Learning Towards Radio-Frequency Filter Design,journalArticle,https://ieeexplore.ieee.org/document/11398183/,10.1109/MoSICom67153.2025.11398183
7NJ9C236,Machine Learning Guided Alignment System for a W-Band Higher Order Mode Generator,journalArticle,https://ieeexplore.ieee.org/document/10462163/,10.1109/LMWT.2024.3371646
4A8FM8CT,Late Breaking Results: Encoder-Decoder Generative Diffusion Transformer Towards Push-Button Analog IC Sizing,journalArticle,https://ieeexplore.ieee.org/document/11133224/,10.1109/DAC63849.2025.11133224
Q4QDIF3P,Enhanced ML-Based Approach for Functional Safety Improvement in Automotive AMS Circuits,journalArticle,https://ieeexplore.ieee.org/document/10351064/,10.1109/ITC51656.2023.00043
X8BQ4E5P,Towards Safe and Efficient Analog Circuit Design: Active Learning for Feasibility Region Exploration,journalArticle,https://ieeexplore.ieee.org/document/10808909/,10.1109/APCCAS62602.2024.10808909
AW9IJR8B,Inverse Analog IC Sizing and Exploration through Diffusion Models and Structural Knowledge,journalArticle,https://ieeexplore.ieee.org/document/11092111/,10.1109/SMACD65553.2025.11092111
34ASEX5E,Joint Estimation of Multiple RF Impairments Using Deep Multi-Task Learning,journalArticle,https://ieeexplore.ieee.org/document/9771740/,10.1109/WCNC51071.2022.9771740
2A5E374I,Kernel-Based Machine Learning Surrogates for RF Circulator Design,journalArticle,https://ieeexplore.ieee.org/document/11379178/,10.1109/APMC65046.2025.11379178
7NBHXFSJ,Artificial Neural Networks for GaN HEMT Model Extraction in D-band Using Sparse Data,journalArticle,https://ieeexplore.ieee.org/document/10186179/,10.1109/RFIC54547.2023.10186179
PQ9I4DTI,Machine-Learning Assisted Digital Predistortion Using Feedback via Dual-Polarized Antenna Arrays,journalArticle,https://ieeexplore.ieee.org/document/10600373/,10.1109/IMS40175.2024.10600373
RU773QAZ,Verilog-A Based ANN Large Signal Modeling of Gan Hemts,journalArticle,https://ieeexplore.ieee.org/document/10479941/,10.1109/REEPE60449.2024.10479941
RAPM3MHG,Design of a Compact Dual-Frequency Impedance Matching Network Using Artificial Neural Network,journalArticle,https://ieeexplore.ieee.org/document/11387680/,10.1109/IMAS66694.2025.11387680
F43U6UG5,A Time-Domain Multi-Tone Distortion Model for Effective Design of High Power Amplifiers,journalArticle,https://ieeexplore.ieee.org/document/9718317/,10.1109/ACCESS.2022.3153355
R29IFZ6X,Design Close to the Edge for Advanced Technology using Machine Learning and Brain-Inspired Algorithms,journalArticle,https://ieeexplore.ieee.org/document/9712493/,10.1109/ASP-DAC52403.2022.9712493
6SNVGB8H,Towards Designing a Unified DNN Architecture for Analog and Mixed-Signal Circuit Characterization,journalArticle,https://ieeexplore.ieee.org/document/11043403/,10.1109/ISCAS56072.2025.11043403
5JCUUDP4,An ANN-Based Approach to the Modelling and Simulation of Analogue Circuits,journalArticle,https://ieeexplore.ieee.org/document/10192134/,10.1109/SMACD58065.2023.10192134
VF8F32VJ,ANN-based Analog IC Floorplan Recommender with a Broader Topological Constraints Coverage,journalArticle,https://ieeexplore.ieee.org/document/9816195/,10.1109/SMACD55068.2022.9816195
FGWCNHIW,AMBEATion: Analog Mixed-Signal Back-End Design Automation with Machine Learning and Artificial Intelligence Techniques,journalArticle,https://ieeexplore.ieee.org/document/10546515/,10.23919/DATE58400.2024.10546515
GC5HENBN,Leveraging Convolutional Autoencoders for Post-Layout Performance Estimation of Analog ICs,journalArticle,https://ieeexplore.ieee.org/document/11270804/,10.1109/ICECS66544.2025.11270804
MM5AI477,On the Exploration of Convolutional Variational Autoencoders for Analog Integrated Circuit Post-Placement Performance Regression,journalArticle,https://ieeexplore.ieee.org/document/11092107/,10.1109/SMACD65553.2025.11092107
UGRMX9C3,RL-Based Digital Predistortion for Wideband Power Amplifiers,journalArticle,https://ieeexplore.ieee.org/document/10978668/,10.1109/WCNC61545.2025.10978668
TN4DWMRN,Invertible Neural Networks for Design of Broadband Active Mixers,journalArticle,https://ieeexplore.ieee.org/document/9900081/,10.1109/MLCAD55463.2022.9900081
VT7HFZ25,Formally Verifying Analog Neural Networks with Device Mismatch Variations,journalArticle,https://ieeexplore.ieee.org/document/10992891/,10.23919/DATE64628.2025.10992891
U4BPTJ9U,AI-Assisted Design of a Compact Voltage Monitoring System with a Millisecond-Delayed Fault Detection Circuit,journalArticle,https://ieeexplore.ieee.org/document/11270785/,10.1109/ICECS66544.2025.11270785
BCVBU9HM,A Fast and Accurate Middle End of Line Parasitic Capacitance Extraction for MOSFET and FinFET Technologies Using Machine Learning,journalArticle,https://ieeexplore.ieee.org/document/9712514/,10.1109/ASP-DAC52403.2022.9712514
6QFA9D8F,A Comparative Analysis of Off-Policy DRL Strategies for Analog Circuit Optimization: A Case Study on Bandgap References,journalArticle,https://ieeexplore.ieee.org/document/11107109/,10.1109/NewCAS64648.2025.11107109
W4TNNPRG,MuaLLM: A Multimodal Large Language Model Agent for Circuit Design Assistance with Hybrid Contextual Retrieval-Augmented Generation,journalArticle,https://ieeexplore.ieee.org/document/11420505/,10.1109/ASP-DAC66049.2026.11420505
NWC99UMN,FEARL: AI-Assisted Energy-Aware Real-Time Receiver Adaptation to Dynamic Environments,journalArticle,https://ieeexplore.ieee.org/document/11161102/,10.1109/ICC52391.2025.11161102
LQBCUF22,A 56–66-GHz FMCW Radar Transceiver With Wide Chirp Bandwidth for Indoor Sensing Applications,journalArticle,https://ieeexplore.ieee.org/document/11264825/,10.1109/TMTT.2025.3633165
BQHKFPCT,A 292.2-to-321.4-GHz Synchronized Source Generator With −58.7-dBc Spurious Tone and 136.7-fs<sub>rms</sub> Integrated Jitter in 22-nm CMOS Technology,journalArticle,https://ieeexplore.ieee.org/document/11022965/,10.1109/TMTT.2025.3571451
3KDGTP7S,A digital-sampling PLL with a second-order noise shaping SAR ADC phase detector,journalArticle,https://ieeexplore.ieee.org/document/10936991/,10.1109/JSSC.2025.3549690
DY42X6M3,The mismatch performance of pseudo digital ring oscillators used in VCO ADCs: PSRR and CMRR,journalArticle,https://ieeexplore.ieee.org/document/9956781/,10.1109/TCSI.2022.3222380
3SWM7ZAZ,Stability characterizing function for electronic circuit design based on frequency-domain analysis with parametric damping,journalArticle,https://ieeexplore.ieee.org/document/10234129/,10.1109/TMTT.2023.3305157
VFW5K66M,Analysis and design of wideband active single-sideband time modulator in 0.13- <i>μ</i> m CMOS,journalArticle,https://ieeexplore.ieee.org/document/10681654/,10.1109/TCSI.2024.3456237
YYN6G5DR,A D-Band Differential Amplifier With Cross-Couple of Series-Connected Capacitor and Transmission Line-Based Dual-Frequency <i>G</i><sub>max</sub> -Core,journalArticle,https://ieeexplore.ieee.org/document/10415006/,10.1109/TCSII.2024.3358808
V6JWHTWC,Artificial neural networks for microwave computer-aided design: The state of the art,journalArticle,https://ieeexplore.ieee.org/document/9863691/,10.1109/TMTT.2022.3197751
TC8J5FS4,On the upconversion of the cross-coupled pair 1/ <i>f</i> noise into phase noise in current-biased class-B CMOS oscillators,journalArticle,https://ieeexplore.ieee.org/document/11150441/,10.1109/TCSI.2025.3602924
I6M2TVW4,Design of wideband doherty power amplifier using inverse continuous class-F mode,journalArticle,https://ieeexplore.ieee.org/document/10477556/,10.1109/TCSII.2024.3379992
IUVCA36G,A scalable and instantaneously wideband RF correlator based on margin computing,journalArticle,https://ieeexplore.ieee.org/document/10704783/,10.1109/JSSC.2024.3465244
AS7EAERI,Interference-tolerant wireless distributed beamforming receiver array with low-latency frequency synchronization,journalArticle,https://ieeexplore.ieee.org/document/10807511/,10.1109/TMTT.2024.3517456
EH3JFB5Q,Design and analysis of 28 GHz CMOS LNA and VGA using gain-linearity-boosting and body floating techniques,journalArticle,https://ieeexplore.ieee.org/document/10566047/,10.1109/TMTT.2024.3410997
SCTTXGBR,Co-optimization technology for nonlinear behavior consistency and efficiency/linearity of power amplifiers,journalArticle,https://ieeexplore.ieee.org/document/11260976/,10.1109/TMTT.2025.3632237
NGXTQA57,Spurious Modes in Model Order Reduction in Variational Problems in Electromagnetics,journalArticle,https://ieeexplore.ieee.org/document/9900488/,10.1109/TMTT.2022.3205597
SPCLVNKU,Flexible Inverse Design of Common-Mode Suppression Filters With Transformer Network,journalArticle,https://ieeexplore.ieee.org/document/11130428/,10.1109/TCAD.2025.3600495
4SCV69HW,Electromagnetic Parametric Modeling Using Combined Neural Networks and RLGC-Based Eigenfunctions for Two-Port Microstrip Structures,journalArticle,https://ieeexplore.ieee.org/document/9912338/,10.1109/TMTT.2022.3208913
WDTREBIC,Cryogenic CMOS microwave signal selector using dual-stage injection-locked oscillator for frequency-multiplexed qubit control system,journalArticle,https://ieeexplore.ieee.org/document/11372165/,10.1109/JSSC.2026.3658602
WIB3HBJ7,Co-Design of an Auxiliary Self-Bias Module and a CMOS Rectifier for RF Energy Harvesting,journalArticle,https://ieeexplore.ieee.org/document/10261221/,10.1109/TCSII.2023.3318410
N9GX5882,On the stability of oscillatory modes in an oscillator based on a distributed amplifier,journalArticle,https://ieeexplore.ieee.org/document/9984122/,10.1109/TMTT.2022.3226454
ZPECQZAF,Class-F<sup>−1</sup> asymmetric doherty power amplifier integrated slot antenna array with high efficiency and large back-off range,journalArticle,https://ieeexplore.ieee.org/document/11124341/,10.1109/TMTT.2025.3596769
SSVZELWH,A multioutput and highly efficient GaN distributed power amplifier for compact subarrays in wideband phased array antennas,journalArticle,https://ieeexplore.ieee.org/document/10122245/,10.1109/TMTT.2023.3269567
3AZMMGIU,A Neural Network-Based Hybrid Physical Model for GaN HEMTs,journalArticle,https://ieeexplore.ieee.org/document/9903349/,10.1109/TMTT.2022.3206442
C8TA2YYG,Wideband LNA employing intrinsic feedback and back-gate resistance for noise and input power matching,journalArticle,https://ieeexplore.ieee.org/document/10309293/,10.1109/TMTT.2023.3326278
2QUS3WLJ,Miniaturized wirelessly powered and controlled implants for multisite stimulation,journalArticle,https://ieeexplore.ieee.org/document/10008956/,10.1109/TMTT.2022.3233368
QLI4MVIS,On the Fulfilment of the Gain and Matching Specifications in the Design of a Single-Stage High-Frequency Amplifier,journalArticle,https://ieeexplore.ieee.org/document/10726637/,10.1109/TCSI.2024.3478806
YLU525QX,Synthetic diversity for artifact suppression and simultaneous multi-band down-conversion in widely-tunable receivers,journalArticle,https://ieeexplore.ieee.org/document/10909986/,10.1109/TCSI.2025.3546170
8YFGTYCQ,Coupling-parameter-based unequal power divider for on-chip systems,journalArticle,https://ieeexplore.ieee.org/document/11103740/,10.1109/TMTT.2025.3591779
IXR9U8FE,Ultrawideband frequency synthesis using the compact tunable transmission line (CTTL),journalArticle,https://ieeexplore.ieee.org/document/9771093/,10.1109/TMTT.2022.3169511
GPDW7NP4,Causal model implementation for the conductor surface roughness effect on the attenuation and delay of microstrip lines,journalArticle,https://ieeexplore.ieee.org/document/10163728/,10.1109/TMTT.2023.3285425
ILRVZY37,Performance bounds of ADC-based receivers due to clock jitter,journalArticle,https://ieeexplore.ieee.org/document/10073649/,10.1109/TCSII.2023.3257844
QZQQHQ5F,A 26-Gb/s 140-GHz OOK CMOS Transmitter and Receiver Chipset for High-Speed Wireless and Dielectric Waveguide Communication,journalArticle,https://ieeexplore.ieee.org/document/10742620/,10.1109/JSSC.2024.3483818
EFDBI9EY,A flexible automated design method for broadband matching networks in power amplifiers,journalArticle,https://ieeexplore.ieee.org/document/10879316/,10.1109/TMTT.2025.3535935
YV93TE62,A low-power V-band radar transceiver front-end chip using 1.5 V supply in 130-nm SiGe BiCMOS,journalArticle,https://ieeexplore.ieee.org/document/10121171/,10.1109/TMTT.2023.3269519
V3F72INI,A 59.2–83.3 GHz CMOS LNA with 18.1 dB gain and 5.1 dB NF using gate-drain transformer,journalArticle,https://ieeexplore.ieee.org/document/10929737/,10.1109/TCSII.2025.3551910
ZR3W6JJW,A Uniform Neural Network Digital Predistortion Model of RF Power Amplifiers for Scalable Applications,journalArticle,https://ieeexplore.ieee.org/document/9900117/,10.1109/TMTT.2022.3205930
KTPNHPI3,Analysis and modeling of super-regenerative oscillators with FSCW signals,journalArticle,https://ieeexplore.ieee.org/document/10713863/,10.1109/TMTT.2024.3470247
ENKKPWFV,A 142–164-GHz phased-array AiP module with high-power-density and high-efficiency transceiver in 65-nm CMOS for 6G UE,journalArticle,https://ieeexplore.ieee.org/document/11418901/,10.1109/JSSC.2026.3665184
ZDQP88BB,Digital Predistortion of RF Power Amplifiers With Phase-Gated Recurrent Neural Networks,journalArticle,https://ieeexplore.ieee.org/document/9750009/,10.1109/TMTT.2022.3161024
8TBGPGSL,Collaborative optimization method for wideband transistor-based rectifiers with a large input power dynamic range,journalArticle,https://ieeexplore.ieee.org/document/11224652/,10.1109/TCSI.2025.3626535
VNI9K7BT,A 6-GHz bandwidth input buffer based on AC-coupled flipped source follower for 12-bit 8-GS/s ADC in 28-nm CMOS,journalArticle,https://ieeexplore.ieee.org/document/9815329/,10.1109/TCSII.2022.3188534
8QRQD2UX,Analysis and design of coupled PLL-based CMOS quadrature VCOs,journalArticle,https://ieeexplore.ieee.org/document/10145092/,10.1109/JSSC.2023.3280360
WWEI2U56,An energy-efficient V-band OOK transmitter with 14.5-gb/s data rate and 11.1% DC-to-RF efficiency,journalArticle,https://ieeexplore.ieee.org/document/11195972/,10.1109/TMTT.2025.3615636
IW8D227Q,RF-input divisional load-modulated balanced amplifier with extended back-off range,journalArticle,https://ieeexplore.ieee.org/document/10964436/,10.1109/TMTT.2025.3556769
9T4ZDFKT,An Adaptive Analog Temperature Compensated W-Band Front-End With ±0.0033 dB/°C Gain Variation Across −30 °C to 120 °C,journalArticle,https://ieeexplore.ieee.org/document/10246321/,10.1109/TCSII.2023.3313815
5H4LLR2A,Nonlinearity-induced spurs in fractional- <i>N</i> frequency synthesizers,journalArticle,https://ieeexplore.ieee.org/document/9761208/,10.1109/TCSII.2022.3169224
H3TFUT4D,Compact multipole GaN-on-si SPDT switch using inductive parasitic effects of hybrid HEMT devices,journalArticle,https://ieeexplore.ieee.org/document/10113229/,10.1109/TMTT.2023.3267543
NB7GYJ3S,Design of a low-cost low-profile energy efficient 64-QAM load modulator,journalArticle,https://ieeexplore.ieee.org/document/9723473/,10.1109/TMTT.2022.3148359
7P68PK3F,A fully packaged 135-GHz multiuser MIMO transmitter array tile for wireless communications,journalArticle,https://ieeexplore.ieee.org/document/9751221/,10.1109/TMTT.2022.3161972
ASAHVMD4,Artificial Neural Network Nonlinear Transistor Behavioral Models: Structure and Parameter Determination Process Based on the Cardiff Model,journalArticle,https://ieeexplore.ieee.org/document/10623296/,10.1109/TMTT.2024.3434959
FF6ER95T,Characterizing interconnects to 325 GHz,journalArticle,https://ieeexplore.ieee.org/document/10759294/,10.1109/TMTT.2024.3496657
43ABPBZU,Low-power decibel-linear programmable-gain amplifier with complementary current-switching technique,journalArticle,https://ieeexplore.ieee.org/document/10040240/,10.1109/TCSI.2023.3241432
IMKBT84S,Dynamic Thermal Coupling in GaN MMIC Power Amplifiers,journalArticle,https://ieeexplore.ieee.org/document/10693626/,10.1109/TMTT.2024.3458189
X5RG77LM,DC-coupled biasing technique for quantized-analog amplifiers,journalArticle,https://ieeexplore.ieee.org/document/10508224/,10.1109/TCSII.2024.3392900
J85C687I,"Analytical side channel EM models, extending simulation abilities for ICs, and linking physical models to cryptographic metrics",journalArticle,https://ieeexplore.ieee.org/document/10168134/,10.1109/TCAD.2023.3289310
ZIGI4CQ9,Machine learning-based uncertainty quantification and design optimization for offset compensation sense amplifiers in DRAMs,journalArticle,https://ieeexplore.ieee.org/document/11142277/,10.1109/TCAD.2025.3603112
P8X8U2ME,Wideband High-Gain Amplifiers in 45-nm CMOS SOI Operating at 0.56 <i>f</i><sub>max</sub> : An Analytical Approach on Reversed Feedback Amplifiers,journalArticle,https://ieeexplore.ieee.org/document/10964135/,10.1109/JSSC.2025.3554814
EGTXK4J3,AnGeL: Fully-Automated Analog Circuit Generator Using a Neural Network Assisted Semi-Supervised Learning Approach,journalArticle,https://ieeexplore.ieee.org/document/10190116/,10.1109/TCSI.2023.3295737
QN2KFPZK,Design and characterization of a variable gain <i>D</i> -band LNA for optimized link budgeting for a 6G receiver in 22FDX,journalArticle,https://ieeexplore.ieee.org/document/10216920/,10.1109/TMTT.2023.3298197
TRRPSYXZ,Bandpass filtering power amplifier with wide stopband and high out-of-band rejection,journalArticle,https://ieeexplore.ieee.org/document/9941498/,10.1109/TCSII.2022.3220619
28XK63QE,Analysis and design of the tank feedline in millimeter-wave VCOs,journalArticle,https://ieeexplore.ieee.org/document/9725241/,10.1109/TMTT.2022.3151668
8Y2QEDHA,MMIC-to-dielectric waveguide transitions for glass packages above 150 GHz,journalArticle,https://ieeexplore.ieee.org/document/10025405/,10.1109/TMTT.2023.3236787
ICAMUIKF,Design of Terahertz Low-Reflection Amplitude Modulator Using Quasi-π Reconfigurable Absorption Network,journalArticle,https://ieeexplore.ieee.org/document/11018172/,10.1109/TMTT.2025.3569705
3DGLSSLU,A highly-efficient doherty power amplifier with generalized parallel-circuit class-EF mode,journalArticle,https://ieeexplore.ieee.org/document/10068738/,10.1109/TCSII.2023.3257168
7QICX6YX,An integrated primary impulse radio ultra-wideband radar for short-range real-time localization,journalArticle,https://ieeexplore.ieee.org/document/9761963/,10.1109/TCSI.2022.3167924
GJBIMF7T,Sequential LMBA design technique for improved bandwidth considering the balanced amplifiers off-state impedance,journalArticle,https://ieeexplore.ieee.org/document/10048716/,10.1109/TMTT.2023.3241690
WZ72IUFX,Advanced bayesian-inspired multilayer effective parameter determination method for automated ANN model generation of microwave components,journalArticle,https://ieeexplore.ieee.org/document/10373763/,10.1109/TMTT.2023.3341584
3R4KAXGE,Wideband and efficient 256-GHz subharmonic- based FMCW radar transceiver in 130-nm SiGe BiCMOS technology,journalArticle,https://ieeexplore.ieee.org/document/9906590/,10.1109/TMTT.2022.3207995
SHKZD98R,Analysis and design of reconfigurable multiband mismatch-resilient quasi-balanced doherty power amplifier for massive MIMO systems,journalArticle,https://ieeexplore.ieee.org/document/9866097/,10.1109/TMTT.2022.3198437
HKIPB92U,Artificial Neural Network-Based Modeling for Estimating the Effects of Various Random Fluctuations on DC/Analog/RF Characteristics of GAA Si Nanosheet FETs,journalArticle,https://ieeexplore.ieee.org/document/9868246/,10.1109/TMTT.2022.3198659
9KIKS59L,Adaptive Stepping PTA for DC Analysis Based on Reinforcement Learning,journalArticle,https://ieeexplore.ieee.org/document/9893885/,10.1109/TCSII.2022.3207356
IQAP63FU,Design of wideband asymmetric doherty power amplifier using a new phase compensation technique,journalArticle,https://ieeexplore.ieee.org/document/10339859/,10.1109/TCSI.2023.3336558
