key,title,item_type,url,doi
J6Q2U2AD,Behavioral modeling method of macromodels for interconnected systems with frequency characteristics and nonlinear termination networks,journalArticle,https://ieeexplore.ieee.org/document/10103200/,10.1109/TCSII.2023.3267473
AH89RAYQ,An MOR Algorithm Based on the Immittance Zero and Pole Eigenvectors for Fast FEM Simulations of Two-Port Microwave Structures,journalArticle,https://ieeexplore.ieee.org/document/9763084/,10.1109/TMTT.2022.3166657
KE7M678Q,A 49.8-mm² IR-UWB transmitter with co-designed power amplifier and antenna for neural implants with extended transmission range,journalArticle,https://ieeexplore.ieee.org/document/10856900/,10.1109/JSSC.2025.3531234
HP7RJTTP,Augmented phase-normalized recurrent neural network for RF power amplifier linearization,journalArticle,https://ieeexplore.ieee.org/document/10745136/,10.1109/TMTT.2024.3484581
F399HSI4,Concise and compatible MOR-based self-adjoint EM sensitivity analysis for fast frequency sweep,journalArticle,https://ieeexplore.ieee.org/document/10057100/,10.1109/TMTT.2023.3248167
CLGBWHWQ,Analysis and Design of Fourth Harmonic Boosting Technique for THz Signal Generation,journalArticle,https://ieeexplore.ieee.org/document/9732204/,10.1109/TCSI.2022.3155477
JC26SU4M,CMOS power amplifier with novel transformer power combiner,journalArticle,https://ieeexplore.ieee.org/document/10024830/,10.1109/TCSII.2023.3238509
TRU5V7D4,An Energy Recycling Envelope Tracking Supply Modulator Assisted by Small Cap Replica With 89.7% Efficiency and 37% Reduced Linear Amplifier Current for 150 MHz Bandwidth 5G New Radio RF Applications,journalArticle,https://ieeexplore.ieee.org/document/9777865/,10.1109/JSSC.2022.3172862
WGVLQ2QZ,Bandlimited DPD adapted APD for 5G communication,journalArticle,https://ieeexplore.ieee.org/document/9781615/,10.1109/TCSII.2022.3177750
TU8RDJ4B,Automatic Op-Amp Generation From Specification to Layout,journalArticle,https://ieeexplore.ieee.org/document/10185586/,10.1109/TCAD.2023.3296374
H36DRSHM,A D-band variable gain low noise amplifier in a 28-nm CMOS process for 6G wireless communications,journalArticle,https://ieeexplore.ieee.org/document/10184126/,10.1109/TCSII.2023.3295430
3SMB4RRG,Digital Predistortion of RF Power Amplifiers With Decomposed Vector Rotation-Based Recurrent Neural Networks,journalArticle,https://ieeexplore.ieee.org/document/9913714/,10.1109/TMTT.2022.3209658
WTZPCC5Z,A temperature-compensated ku-band four-beam phased-array receiver with low attenuation and relative phase variations,journalArticle,https://ieeexplore.ieee.org/document/10730791/,10.1109/TCSII.2024.3485476
AQVZQCQZ,An I/Q imbalance calibration scheme for 5G direct-conversion transmitter,journalArticle,https://ieeexplore.ieee.org/document/11073570/,10.1109/TCSII.2025.3586873
DSNI3JYA,Reliable computationally efficient behavioral modeling of microwave passives using deep learning surrogates in confined domains,journalArticle,https://ieeexplore.ieee.org/document/9960820/,10.1109/TMTT.2022.3218024
GEIVP8UF,Analysis of offset spurs in phase-locked-loops employing harmonic-mixer-based feedback with sample-and-hold operation,journalArticle,https://ieeexplore.ieee.org/document/9899485/,10.1109/TCSI.2022.3206837
86BUAGZ8,LO generation for a 5G phased array transceiver: A high HRR 21–27-GHz frequency quadrupler,journalArticle,https://ieeexplore.ieee.org/document/10870479/,10.1109/TMTT.2025.3529344
LKLR4AKQ,Large-signal stability analysis of power amplifiers under mismatch conditions based on structured singular values computation,journalArticle,https://ieeexplore.ieee.org/document/11261217/,10.1109/TMTT.2025.3630240
DDG4YQQ2,Design and application of novel single- and dual-band reconfigurable microwave components with filter and coupler functions,journalArticle,https://ieeexplore.ieee.org/document/9763070/,10.1109/TMTT.2022.3162842
NFKCTXYF,Reconfigurable 2.4/5.0-GHz Dual-Band CMOS Power Amplifier for WLAN 802.11ax,journalArticle,https://ieeexplore.ieee.org/document/10504917/,10.1109/TCSI.2024.3385483
WU8BSMBQ,Physical Layer Security Through Directional Modulation With Spatio-Temporal Millimeter-Wave Transmitter Arrays,journalArticle,https://ieeexplore.ieee.org/document/10517973/,10.1109/JSSC.2024.3384373
3GGHATXE,A Scalable Knowledge-Based Neural Network Model for GaN HEMTs With Accurate Trapping and Self-Heating Effects Characterization,journalArticle,https://ieeexplore.ieee.org/document/10058706/,10.1109/TMTT.2023.3248225
29CBCE8R,Artificial neural network based calibration for a 12 b 250 MS/s pipelined-SAR ADC with ring amplifier in 40-nm CMOS,journalArticle,https://ieeexplore.ieee.org/document/10620219/,10.1109/TCSI.2024.3429309
4G2YXJHA,Noise analysis of a 434-MHz wakeup receiver analog frontend core with −93-dBm input sensitivity and 65-pJ/bit efficiency based on a switched injection-triggered oscillator with surface acoustic wave resonator,journalArticle,https://ieeexplore.ieee.org/document/10745803/,10.1109/TMTT.2024.3482456
AS4X4R9N,Compressed machine learning-based inverse model for design optimization of microwave components,journalArticle,https://ieeexplore.ieee.org/document/9761999/,10.1109/TMTT.2022.3166151
JR73DUAE,A Novel NN-Based Fast-Convergence Background Calibration for Timing Mismatch in TI ADCs,journalArticle,https://ieeexplore.ieee.org/document/10713450/,10.1109/TCSII.2024.3477463
4PGCMHQI,Design of Two-Way Transformer Combining <i>E</i> -Band Power Amplifiers Using 16-nm FinFET Technology With Optimal Matching Networks,journalArticle,https://ieeexplore.ieee.org/document/10850652/,10.1109/TMTT.2025.3529201
REUW39KF,Arbitrary shaped high-voltage RF switch,journalArticle,https://ieeexplore.ieee.org/document/10354456/,10.1109/TCSII.2023.3342072
AHXY8BYZ,An Edge-Combining Frequency-Multiplying Class-D Power Amplifier,journalArticle,https://ieeexplore.ieee.org/document/9765583/,10.1109/TCSII.2022.3171495
S4T94UQH,Cost-effective enhancement of RF switch performance utilizing novel coupling structures,journalArticle,https://ieeexplore.ieee.org/document/11164342/,10.1109/TMTT.2025.3607951
JT93MFWU,A wideband IQ-mapping direct-digital RF modulator for 5G transmitters,journalArticle,https://ieeexplore.ieee.org/document/9705146/,10.1109/JSSC.2022.3144362
K79WQP3K,A Deep Reinforcement Learning Framework for High-Dimensional Circuit Linearization,journalArticle,https://ieeexplore.ieee.org/document/9796640/,10.1109/TCSII.2022.3183156
BC5A9TE8,A 25 MHz-BW 81 dB-DR TDC-based CTDSM with background analog-integration-based ISI error calibration achieving >8 dB even-order harmonic suppression,journalArticle,https://ieeexplore.ieee.org/document/11024031/,10.1109/TCSI.2025.3572048
XM9LJPWR,CMOS saturation spectrometer with a miniaturized fabry–pérot cavity for the lamb-dip interrogation of OCS molecules to enhance the <i>Q</i> of CSMC,journalArticle,https://ieeexplore.ieee.org/document/11044868/,10.1109/TMTT.2025.3577939
SBH8GYLU,A Wideband Compact Digitally-Assisted Variable Gain Phase Shifter for Ka-Band Applications,journalArticle,https://ieeexplore.ieee.org/document/10807233/,10.1109/TCSII.2024.3520144
EQ6QSPW5,Synthesis of ladder- and DMS-type acoustic wave filters and duplexers in bandpass domain,journalArticle,https://ieeexplore.ieee.org/document/10416884/,10.1109/TMTT.2024.3354937
WFZ7E4MW,Input amplitude-based adaptive tuning neural networks for digital predistortion of doherty power amplifiers,journalArticle,https://ieeexplore.ieee.org/document/10693638/,10.1109/TMTT.2024.3461952
XYFNMM99,Design of a 0.4–3.9-GHz wideband high-efficiency power amplifier based on a novel bandwidth extended matching network,journalArticle,https://ieeexplore.ieee.org/document/10061612/,10.1109/TCSII.2023.3253551
EGH73HEQ,Asynchronous Parallel Expected Improvement Matrix-Based Constrained Multi-Objective Optimization for Analog Circuit Sizing,journalArticle,https://ieeexplore.ieee.org/document/9768116/,10.1109/TCSII.2022.3172408
GZFZCQ82,Bridging the Gap Between Artificial Neural Networks and Kernel Regressions for Vector-Valued Problems in Microwave Applications,journalArticle,https://ieeexplore.ieee.org/document/10005863/,10.1109/TMTT.2022.3232895
V4P8UHFM,A PLL technique: Charge-steering sampling,journalArticle,https://ieeexplore.ieee.org/document/11017517/,10.1109/JSSC.2025.3566271
9IZGS38Q,Wideband high selectivity filter chips with adjustable bandwidth based on IPD technology,journalArticle,https://ieeexplore.ieee.org/document/9805800/,10.1109/TCSII.2022.3186182
RR3JWGBX,Channel filter extraction for coupled-resonator diplexers,journalArticle,https://ieeexplore.ieee.org/document/10616163/,10.1109/TMTT.2024.3433021
M6DU5X32,A harmonic-mixing PLL architecture for millimeter-wave application,journalArticle,https://ieeexplore.ieee.org/document/9916251/,10.1109/JSSC.2022.3209614
9AXTUC34,Analysis and design of reactive passive mixers for high-order modulation IoT cartesian transmitters,journalArticle,https://ieeexplore.ieee.org/document/10363629/,10.1109/TMTT.2023.3341393
B9WKL536,Design considerations of high- frequency-reference fractional- N PLL: Architecture and nonidealities,journalArticle,https://ieeexplore.ieee.org/document/10934764/,10.1109/JSSC.2025.3548028
VXLCRIAP,A Cycle-Slip Compensated FMCW Digital PLL With Background Back-Tracking DPD,journalArticle,https://ieeexplore.ieee.org/document/11103574/,10.1109/JSSC.2025.3590136
6RKMBMDI,Inverse design of tunable lowpass microstrip filters based on generative adversarial network and transfer learning,journalArticle,https://ieeexplore.ieee.org/document/10382154/,10.1109/TCSII.2024.3350137
RN7RSEGP,Self-coupling and mutual pulling in phase-locked loops,journalArticle,https://ieeexplore.ieee.org/document/9733195/,10.1109/TCSI.2022.3155517
SAA7NRKX,Fast recovery performance and design method for high-power microwave limiter using GaN-SBD technology,journalArticle,https://ieeexplore.ieee.org/document/10423991/,10.1109/TMTT.2024.3360246
GE3W9QEE,Design of dual-band doherty power amplifier using a new phase compensation technique,journalArticle,https://ieeexplore.ieee.org/document/10312757/,10.1109/TCSII.2023.3331250
8G8GJUHN,Design of a fully integrated wideband continuous-mode asymmetrical doherty power amplifier in GaN-on-SiC HEMT technology,journalArticle,https://ieeexplore.ieee.org/document/10612840/,10.1109/TCSII.2024.3434572
A3XK4E8S,Coupling Matrix Reconfiguration Based on Matrix Completion,journalArticle,https://ieeexplore.ieee.org/document/10528879/,10.1109/TMTT.2024.3396154
B83Z5KCW,An 18~30 GHz Vector-Sum Phase Shifter With Two-Stage Transformer-Based Hybrid in 130-nm SiGe BiCMOS,journalArticle,https://ieeexplore.ieee.org/document/10231375/,10.1109/TCSI.2023.3305613
WNR5LSYK,Circuit model extraction of coupled-resonator diplexers and multiplexers with unconventional topologies,journalArticle,https://ieeexplore.ieee.org/document/11198836/,10.1109/TMTT.2025.3616213
CUXG856H,Tutorial and Perspectives on MAGICAL: A Silicon-Proven Open-Source Analog IC Layout System,journalArticle,https://ieeexplore.ieee.org/document/9769692/,10.1109/TCSII.2022.3172869
PDYDI5KW,A high-quality data acquisition method for machine-learning-based design and analysis of electromagnetic structures,journalArticle,https://ieeexplore.ieee.org/document/10090238/,10.1109/TMTT.2023.3259477
9IIFY2NX,Neural-network-based automated synthesis of transformer matching circuits for RF amplifier design,journalArticle,https://ieeexplore.ieee.org/document/9872118/,10.1109/tmtt.2022.3199756
I8VD9A8C,PDF,attachment,https://ieeexplore.ieee.org/stampPDF/getPDF.jsp?tp=&arnumber=9872118&ref=,
AZET238X,Bayesian optimization approach for RF circuit synthesis via multitask neural network enhanced gaussian process,journalArticle,https://ieeexplore.ieee.org/document/9852008/,10.1109/TMTT.2022.3194980
8C83SPG5,PDF,attachment,https://ieeexplore.ieee.org/stampPDF/getPDF.jsp?tp=&arnumber=9852008&ref=,
WHHZFBC5,Adaptive synthesis using hybrid genetic algorithm and particle swarm optimization for reflectionless filter with lumped elements,journalArticle,https://ieeexplore.ieee.org/document/10132002/,10.1109/TMTT.2023.3276212
49URRZWF,0.52-mW 30-GHz LNA in 22-nm FDSOI CMOS,journalArticle,https://ieeexplore.ieee.org/document/10160096/,10.1109/TCSII.2023.3288354
8CBVH5VN,PDF,attachment,https://ieeexplore.ieee.org/stampPDF/getPDF.jsp?tp=&arnumber=10546477&ref=,
GPSKHSD4,2026_Jiang et al_Performance-oriented broadband inverse d.pdf,attachment,https://ieeexplore.ieee.org/stampPDF/getPDF.jsp?tp=&arnumber=11274407&ref=,
KNEBFHKK,2022_Huang et al_Bayesian optimization approach for RF ci,attachment,https://ieeexplore.ieee.org/stampPDF/getPDF.jsp?tp=&arnumber=9852008&ref=,
B6NT8MDL,2023_Li et al_Adaptive synthesis using hybrid genetic,attachment,https://ieeexplore.ieee.org/stampPDF/getPDF.jsp?tp=&arnumber=10132002&ref=,
8CEAIL2R,PDF,attachment,https://ieeexplore.ieee.org/stampPDF/getPDF.jsp?tp=&arnumber=10132002&ref=,
